Название вакансии,Оклад,URL,Название компании,Метро,Описание
Программист-разработчик python (midle),90 000-200 000 руб.,https://hh.ru/vacancy/35758988?query=python, CATAPULTO.RU,,"Участие в проектировании систем. Разработка нового функционала на Django. Рефакторинг текущей кодовой базы. Поиск ошибок, их устранение. Разработка интеграций с... Опыт работы с MySQL / Postgres. Опыт работы с Shinx. Опыт работы c redis / rabbitmq. Опыт работы с docker / docker-compose. "
Junior Python developer,80 000-150 000 руб.,https://hh.ru/vacancy/35807715?query=python,ООО Константа,, Знание python 3.5+. — Желание работать не с Django. Мы совсем не используем Django в разработке. Плюсом будет знакомство...
Python Data Scientist,от 150 000 руб.,https://hh.ru/vacancy/35906317?query=python, Web Interactive World,,Потоковая обработка данных. Тематическое моделирование. Построение моделей объектной тональности. Решать задачи на стыке графовых структур и ML. Работать с семантикой... Умеете программировать на Python. Не боитесь сложной математики и можете разобраться со статьёй на arxiv и повторить это в коде. 
Программист Python (ГИС),от 140 000 руб.,https://hh.ru/vacancy/35813994?query=python, РеИнформ Инт.,,"Разработка инструментов для для обработки и анализа пространственных данных. - Разработка модулей для QGIS. Высшее техническое образование. - Опыт разработки на Python 2.7, 3.7 от 1 года. - Опыт работы с реляционными БД (PostgreSQL). - "
Web-разработчик Python,60 000-100 000 руб.,https://hh.ru/vacancy/35646714?query=python, Carbon Soft,,"90% Backend разработка на Python. 10% Frontend разработка (HTML, CSS, JS, JQuery, Bootstrap, шаблонизатор). Любить программирование. Опыт программирования на Python. Знание git или другой системы контроля версий. Опыт работы с Django, Flask или подобными. "
Senior Python Developer,200 000-300 000 руб.,https://hh.ru/vacancy/35893261?query=python, Arrival Digital,,"Внедрение и поддержка системы ERP Odoo в нескольких подразделениях компании Arrival. Интеграция системы Odoo с внутренними и внешними системами. Python 3 (Flask, Django, Pyramid, FastAPI). Amazon Web Services (EC2, Beanstalk, S3, Lambda). Базовое понимание технологий фронтенда (HTML..."
Senior Python разработчик,от 220 000 руб.,https://hh.ru/vacancy/30424698?query=python,ООО ВижнЛабс (VisionLabs),,"Разработка архитектуры сервисов распознавания лиц и компьютерного зрения, поддержка и развитие функционала. - Создание внешних API для работы с партнёрами. -  Необходимый опыт и знания: - Широкий опыт разработки на Python (3.x) от 2х лет. - Плюсом будет знание одного или..."
Python разработчик,120 000-170 000 руб.,https://hh.ru/vacancy/35900573?query=python, iTrend,," Опыт коммерческой разработки на Python 3.5+/Django от 3-х лет. - Понимание работы протокола HTTP, опыт проектирования REST..."
Разработчик Python Backend,от 150 000 руб.,https://hh.ru/vacancy/35906395?query=python, Web Interactive World,,"Сбор данных, разработка архитектуры их хранения, представление их удобном для анализа виде. Построение архитектуры решения, написание ключевых блоков кода проекта.  Отличное знание Python 3.6 (ООП). Опыт работы с веб-фреймворками Django, Celery. Владение многопоточным multiprocessing и асинхронными подходами asyncio..."
Python разработчик,100 000-150 000 руб.,https://hh.ru/vacancy/35620095?query=python, RU-CERT,,Разработкой серверной части веб-приложений (REST API). Автоматизацией процессов обработки данных. Интеграцией модулей анализа вредоносной активности в распределенные системы.  Опыт работы в Linux/Unix. Знание git. Опыт в разработке асинхронных python-приложений (asyncio). Опыт работы с веб-серверами (nginx...
Back-end разработчик (Python),80 000-120 000 руб.,https://hh.ru/vacancy/35907167?query=python,ООО Когнитивные системы,,"Разработка проектов, реализующих функционал искусственного интеллекта (ИИ). Поддержка существующих вэб-приложений и сервисов: улучшение кода, создание новых фич и расширение... Python ООП + Функциональное программирование (map, reduce и т.д.). Навыки Linux bash, Jupyter notebook. PostgreSQL, Mysql (SQLAlchemy), Pandas. "
Senior Python developer,до 300 000 руб.,https://hh.ru/vacancy/35975570?query=python, Improvado,,"Разрабатывать и внедрять новый продуктовый функционал. Оптимизировать существующие решения, в т.ч. архитектурные с точки зрения производительности, надежности, расширяемости.  Опыт разработки на Python от 4-х лет (знание алгоритмов, понимание и умение применять паттерны проектирования, покрытие тестами, multi-process..."
Программист Wolfram Mathematica и Python,,https://hh.ru/vacancy/35956763?query=python, IntergridMidwest Group LLC (ИП Кляхандлер М.Л.),,"Поддерживать и улучшать имеющиеся программы, писать новые с нуля. Программы инженерные и исключительно для внутреннего пользования в компании. Высшее техническое образование (математики, физики, энергетики - плюс). Хорошее знание Wolfram Mathematica/Python или желание и возможность их выучить. "
Программист Python,170 000-250 000 руб.,https://hh.ru/vacancy/35782747?query=python,ООО Дефенс Групп,,"Автоматическое тестирование (pytest, tox). Виртуализация на уровне ОС (Docker, Swarm, kubernetes). Системы управления конфигурацией (Ansible). Уверенное знание Python 3. Разработка API (Flask, SQLAlchemy, marshmallow, OpenAPI/Swagger). Знание SQL, опыт работы с MySQL и оптимизации запросов. "
Python developer,от 4 000 USD,https://hh.ru/vacancy/30005963?query=python, NetworkOptix,,"Исследование проблем в работе тестируемого продукта с помощью различных инструментов. Библиотека для тестирования — Python-проект для работы с виртуальными машинами... Умение и опыт работы в команде. Уверенные знания Python. Опыт разработки под Linux, знание командной строки Linux. Наличие примеров кода. "
Программист-разработчик Python (junior),,https://hh.ru/vacancy/35028427?query=python, Ростелеком - Центры обработки данных,,Участие в обсуждении архитектуры продукта. Разработка backend и frontend на python. Работа с базой данных на PostgreSQL. Поддержка и доработка... Алгоритмическая подготовка. Техническое образование или эквивалентный практический опыт. Знание Python 3.5+. Умение писать простые SQL-запросы. 
Senior Python Developer (to Riga),,https://hh.ru/vacancy/35713241?query=python, Betby,,"Писать web-сервисы и их компоненты. Работать с самыми новыми фреймворками. Вести документацию. Опыт с Python не менее 3х лет - важно. Опыт асинхронного программирования(особенно полезен опыт работы с aioamqp, aiohttp). "
Python Software Engineer,800-2 500 USD,https://hh.ru/vacancy/35789785?query=python, Route4Me,,"Ему придется разрабатывать python-based проекты с нуля полностью самостоятельно, или в составе команды. Внедрять и участвовать в разработке математических... ...Python. Знание возможностей Python и экосистемы Python (модули, IDE, shell & bash). Опыт настройки среды Linux / Unix с помощью инструментов Python. "
Data Sсientist (ML/Python),,https://hh.ru/vacancy/33481247?query=python, ДомКлик,,"Разрабатывать и внедрять сервисы, использующие машинное обучение и deep learning. Участвовать в процессе подготовки данных. Разрабатывать различные модели машинного обучения.  Навыки программирования, умение писать хорошо читаемый код, знание Python. Знание и опыт работы с реляционными СУБД (мы используем Postgres). "
Junior python-разработчик,,https://hh.ru/vacancy/35790544?query=python, РБК,,"Разработка веб-краулеров. Сопровождение существующего кода. Техническая поддержка существующих сервисов. Базовые знания языка Python: основные типы данных, управляющие конструкции, модули, функции, классы. Базовое понимание HTTP и HTML. Понимание основных принципов..."
Разработчик Python,,https://hh.ru/vacancy/35350974?query=python, ИнПлат,,"Реализация бэкенд-сервисов на языке Python. Полная ответственность за финальный продукт, в том числе за разработку, настройку инфраструктуры, тестирование, вывод... Опыт разработки на Python 3 не менее 2-х лет. Хорошее знание SQL. Умение писать асинхронный код (asyncio). "
QA Automation Engineer (Python),от 3 000 USD,https://hh.ru/vacancy/35419959?query=python, NetworkOptix,,"Продукт — система видеонаблюдения NX Witness — кроссплатформенный коробочный продукт, работающий распределенно в сетях. Тесты — Python-проект для работы с виртуальными машинами... Понимание HTTP, навыки работы с HTTP API из Python и командной строки (wget, curl, httpie, jq). Знания Jenkins (Jenkins job..."
Стажер-разработчик Python,от 50 000 руб.,https://hh.ru/vacancy/35930216?query=python,ООО Корпорация АЛЬФА,,"Разработка программного продукта по автоматизированному анализу контрагентов и финансовых операций. Разработка нового функционала на Django. Разработка и написание алгоритмов, создание... Хорошее знание Python (3.X). Опыт разработки приложений на Django. Дополнительные пакеты и расширения Django (Django REST Framework / Sentry / Celery..."
Python middle developer,120 000-160 000 руб.,https://hh.ru/vacancy/35846230?query=python, BestDoctor,, 
Python/Django разработчик / we⁢b developer (python/django),70 000-120 000 руб.,https://hh.ru/vacancy/35782052?query=python,ООО Клаустрофобия,,"Разработка корпоративного CRM. Оптимизация кода и запросов в БД. Доработка backend (Python, Django). Разработка внутренних проектов ит-отдела.  Опыт разработки от 3 лет. Опыт разработки на Javascript. Опыт разработки на Python и знание фреймворка Django. Опыт работы с..."
Разработчик Python,,https://hh.ru/vacancy/35868679?query=python, Netris,,"Разработка серверной части проектов. Сопровождение, оказание консультаций клиентам и сотрудникам отдела технической поддержки по разрабатываемым веб-проектам. Сопровождение существующих веб... Уверенные знания Python. Знание принципов ООП. Опыт работы в GIT. Опыт работы с Linux. Хорошее знание SQL. Опыт сетевого и..."
Разработчик Python(Django),,https://hh.ru/vacancy/35875713?query=python,ООО Датамайнинг Солюшинс,,"Разработка нового функционала на Django и не только (при желании). Рефакторинг текущей кодовой базы. Поиск ошибок, их устранение.  Знание Python (версии 3+). Опыт работы с Django + DRF. Опыт работы с реляционными БД (мы используем не только..."
Программист (Python\Django\HTML\CSS\JS),от 100 000 руб.,https://hh.ru/vacancy/35549778?query=python,ООО Портал Каргокс,,"...верстка, не было конфликтов в работе других модулей и т.д. Сайт самописный, работает на Django Framework и Python 3. Обязательные требования - Знание языков: Python 3, MySQL, js, HTML, CSS (SCSS, SASS), Системы управления контентом (CMS): Самописные проекты Фреймворки: Django..."
Python Web Developer,200 000-300 000 руб.,https://hh.ru/vacancy/34831620?query=python, Soshace,,Guarantee of regular payments and reliable clients. We search for clients and do all the paperwork. After the first project... 3+ years of professional software development experience with Python. 1+ year of professional experience with Django. 
Программист Python,60 000-80 000 руб.,https://hh.ru/vacancy/36019031?query=python,ООО Мировой поток,,Парсинг данных. Отличное знание Python 3.х и его экосистемы. Желание учиться и развиваться. Selenium. BeautifulSoup. SQL.
Разработчик бэкэнд (Python),,https://hh.ru/vacancy/35791520?query=python, АНО Инфокультура,, Опыт в использовании Python от 3 лет. - Опыт работы с PostgreSQL и MongoDB от 3 лет. - Понимание принципов ООП и...
Разработчик Python / Django,70 000-80 000 руб.,https://hh.ru/vacancy/35851481?query=python, IT Gene,,Поддержка и разработка порталов‚ обеспечивающих взаимодействие заказчика с распределенной сетью контрагентов (написаны на Django). Поддержка механизмов обмена данных между порталами... Опыт работы в аналогичной должности от двух лет. Опыт разработки на Python 2.7 и 3.5‚ Django 1.8...
Программист Python,от 150 000 руб.,https://hh.ru/vacancy/35848488?query=python,ООО ВойсЛинк,,"Разработка программного обеспечения встраиваемых систем под Linux и десктопных приложений под Windows. Проверка, поддержка собственного кода, написание сопроводительной документации. Опыт коммерческой разработки на Python от 2-х лет. Опыт работы с реляционными базами данных. Навыки администрирования, опыт разработки приложений..."
Системный программист Python/Rust,,https://hh.ru/vacancy/35851499?query=python, Group-IB,,Разрабатывать новые модули для существующих проприетарных СЗИ. Разрабатывать ПО для решения внутренних задач аналитики и разработки. Интегрировать наши продукты с... Уверенное знание Python и Rust (опыт коммерческой разработки от 1 года на каждом языке). Опыт системного программирования от 1 года. 
Junior Python разработчик,40 000-50 000 руб.,https://hh.ru/vacancy/35291489?query=python, amoCRM,,"Задачи, с которыми придется столкнуться в первую очередь: написание тестов/автотестов, решение багов и простых задач. В последствии разработка нового... Ansible. - Linux utilities. - Bash. Потребуется: Знание Python (есть практический опыт и результаты, не обязательно коммерческие). Опыт написания SQL запросов (желательно..."
Python Developer,,https://hh.ru/vacancy/36027329?query=python," Лента, федеральная розничная сеть, IT ",,"Разрабатывать серверную часть продукта, работать над интеграциями микросервисов. Разрабатывать высоконагруженные сервисы. Оптимизировать код с целью повышения производительности. Python 3.7. Django 2.2 + django-rest-framework. Postgres+postgis. OSRM. Опыт разработки от 2-х лет. "
Разработчик Python,150 000-200 000 руб.,https://hh.ru/vacancy/35994995?query=python, Vilesse,," Хорошее знание Python и экосистемы. Опыт с PostgreSQL или MySQL. Git на уровне ежедневной практики. Хорошее знание Linux, shell scripting. "
Программист Python,от 170 000 руб.,https://hh.ru/vacancy/35772690?query=python,ООО Твигл,,"Использование Cython, Python C API, C/C++, Golang. Большим плюсом будет: Хорошее знание Linux систем. Опыт работы с данными в Python: numpy, pandas и прочее. Опыт работы с..."
Билд-инженер/Программист Python (Continuous Integration),,https://hh.ru/vacancy/35642567?query=python, Gaijin Entertainment,,"Оптимизация сборки. - Выполнение сборки общих библиотек. - Разработка программных модулей для автоматизации/оптимизации процессов сборки и анализа качества ПО. -  Отличное знание языка Python, знание и навыки работы с GIT. - Хорошее понимание процессов разработки ПО. - Знание Windows и Linux. - "
Программист Python в конструкторское бюро,120 000-150 000 руб.,https://hh.ru/vacancy/35755446?query=python,ЗАО МНИТИ,,"Разработка приложений на Python, связанных с обработкой текстовых, мультимедийных данных. Обработка данных полученных из источников интернета, в том числе из... Опыт программирования на Python. Опыт работы с Django, scikit-learn, teansorflow. Знание основ SQL. Дружба с Linux."
Программист Python (Middle),до 120 000 руб.,https://hh.ru/vacancy/35407062?query=python,ООО Лендсбэй,," Обязательные навыки: Опыт работы на соответствующей позиции от 2 лет. Уверенное знание Python 3.х, PostgreSQL, SQL, опыт работы с..."
Python senior developer,180 000-250 000 руб.,https://hh.ru/vacancy/35846205?query=python, BestDoctor,, 
Senior Python developer (Cloud Services),180 000-230 000 руб.,https://hh.ru/vacancy/35649234?query=python, IVIDEON,,Возглавит небольшую продуктовую команду (2-3 разработчика). Вместе с нами будет разрабатывать бэкенд Ivideon. Проектировать архитектуру новых сервисов.  Опыт коммерческой разработки на Python от 3х лет. Понимание всей этой истории с микросервисной архитектурой. Опыт работы с асинхронкой...
ML / NLP Data Scientist / Python Lead Developer,от 150 000 руб.,https://hh.ru/vacancy/35972022?query=python, Quark Capital,, Математическое / Физическое / Computer Science образование хорошего университета - обязательно указывайте средний балл. Опыт back-end Python и ML-frameworks. 
Программист Python,от 150 000 руб.,https://hh.ru/vacancy/35826091?query=python, Ремонтиста,,Разработка backend части проекта в автомобильной тематике. Подтвержденный опыт работы программистом Python от 3-х лет. Обязателен опыт коммерческой разработки веб-сервисов. Отличное знание Python 3.х...
Team lead Python developer,180 000-250 000 руб.,https://hh.ru/vacancy/35846186?query=python, BestDoctor,, 
Web разработчик (Python),,https://hh.ru/vacancy/35871016?query=python,ООО НТ Прогресс,,"Разработка Web портала в agile команде. Участие в полном цикле разработки. Хорошие знания Python и опыт работы с Django. Опыт работы с SQL (Postgre SQL). Знание Web технологий: HTML5, JavaScript. "
Python developer,100 000-140 000 руб.,https://hh.ru/vacancy/36000190?query=python, Neurodata Lab,,"Развитие и поддержание существующей облачной платформы, предоставляющей доступ к нашим нейросетевым технологиям. Участие в развитии SDK. Создание новых программ для... Знание Python3 на высоком уровне. Знание паттернов архитектурирования, в том числе микросервисы. Умение писать асинхронный код. Уверенное использования баз..."
