Название вакансии,Оклад,URL,Название компании,Метро,Описание
Программист Python,,https://hh.ru/vacancy/35568546?query=python, KamaGames Studio,,"Система мониторинга (свой проект, вырос из дашборда для Заббикса). Скрипты сборщики для мониторинга. Формулы и модули для системы конфигурирования Salt... Хорошие навыки программирования на Python. Уверенные навыки работы с Linux. Общая инженерная адекватность: базовые знания сетей, представление о том, как..."
QA Engineer (Python),,https://hh.ru/vacancy/34909381?query=python,ООО Т8,,Анализ требований и разработка тестов. Функциональное тестирование сервисов. Автоматизация тестирования. Настройка и поддержка тестовых стендов. Опыт написания тест-кейсов. Знание методологий тестирования. Хорошее знание Python. Опыт работы с Unix / Bash. Опыт работы с Docker контейнерами. 
Python разработчик,до 160 000 руб.,https://hh.ru/vacancy/35998801?query=python, Star-staff,,"Данные храним в PostgreSQL, Redis и InfluxDB. Devops — ansible & docker. Разработка архитектурных решений и разработка функционала сервиса игр.  Что необходимо знать/уметь: Хорошее знание Python (от 3х боевых лет). Опыт работы с Flask, Django. Знание Redis. "
Senior Python Developer,,https://hh.ru/vacancy/35191353?query=python, FunCorp,,"Сервис распознавания текста из изображений. Сервис нечёткого поиска дубликатов изображений. Сервис рекомендаций контента. Сервис предварительной оценки загружаемого контента.  Высшее техническое образование, знание алгоритмов и любовь к ним. Сильная экспертиза в Python 3 (AsyncIO, Flask, Django). Опыт построения и..."
Инженер-программист (Python),100 000-140 000 руб.,https://hh.ru/vacancy/35740325?query=python, SPN,,"Разработка системы авторизации клиентов (backend); поддержка существующей системы. Разработка нового функционала. Разработка/внедрение систем управления оборудованием (Linux серверы, коммутаторы, wi... Опыт и понимание работы web сервиса на базе python/nginx/httpd. Опыт и понимание работы протокола RADIUS. Опыт и понимание..."
Python developer,до 160 000 руб.,https://hh.ru/vacancy/34891660?query=python, Левел Тревел,,Разработка микросервисов и приложений совместно с командой Data Science и их интеграция в основные продукты копании - поиск и актуализацию туров.  Python 3. MySQL/PostgreSQL. Представляешь зачем нужен Git и как создавать ветки. Умение самостоятельно продумать решение задачи и довести его...
"Python Developer (Cyprus, Limassol)",,https://hh.ru/vacancy/35608360?query=python, Exness,," At least 3 years of using Python: good knowledge of python 2.7 and python 3+, compliance with pep..."
Программист Python (стажер),,https://hh.ru/vacancy/35621537?query=python,АО РТИ,,Проектирование и разработка программных продуктов. Написание Unit тестов. Участие в декомпозиции и формирование задач в спринте. Документирование разрабатываемого функционала ПО. Практический опыт работы от полугода. Знание и навыки в применении шаблонов проектирования. Английский язык на уровне чтения технической документации.
Python разработчик,,https://hh.ru/vacancy/35741426?query=python, RU-CENTER Group,,"Сбор и анализ потребления ресурсов клиентами - более двух млн. данных в минуту. Анализ клиентских файлов на наличие уязвимостей.  Наши пожелания к опыту: Опыт разработки на Python, а еще Django и Django REST framework. Опыт разработки юнит-тестов. "
Разработчик Python,,https://hh.ru/vacancy/35013498?query=python, ДомКлик,,"...Python. Участие в проектировании архитектуры, выработке решений по отказоустойчивости и производительности. Разработка бэкэнда для мобильных и веб-приложений на Python.  Опыт работы в области создания программного обеспечения в качестве разработчика от 2 лет. Опыт работы хотя бы с одним из..."
Python Backend Engineer,,https://hh.ru/vacancy/35845670?query=python, NVIDIA,,"Building new API to run performance tools on farm of GPUs. Creating new microservices for analytics of performance measurements.  3+ years experience with Python. Knowledge of popular Python web frameworks (Django, aiohttp, sanic). Knowledge of distributed messaging systems. "
Программист-разработчик Python,,https://hh.ru/vacancy/35028277?query=python, Ростелеком - Центры обработки данных,,"Доработка текущих проектов. Участие в разработке новых проектов. Знание основных библиотек и шаблонов проектирования. Опыт разработки на Python. Опыт разработки БД: реляционная алгебра, индексы, оптимизация запросов. "
Программист Python,,https://hh.ru/vacancy/36013732?query=python, Сбербанк для экспертов,,"разработка сценариев/скриптов/диалогов для виртуальных ассистентов и чат-ботов. - формирование технических требований к функциональности виртуальных ассистентов и чат-ботов. -  знание языка программирования Python не ниже Junior. - техническая грамотность, внимательность к деталям. - умение читать техническую документацию и спецификации. - ""технический"" английский. - "
Python developer,150 000-200 000 руб.,https://hh.ru/vacancy/35771720?query=python, B2Broker,," Имеет опыт коммерческой разработки на Python 3 от 6 лет. Знает и умеет использовать: итераторы, генераторы, потоки. Отлично владеет знаниями..."
Python software engineer,от 170 000 руб.,https://hh.ru/vacancy/35351213?query=python, Руформ,,"Обеспечить высокое качество продукта (быстродействие, оптимизация, масштабирование). Создавать новые микро-сервисы. Обеспечить покрытие unit-тестами. Сопровождать текущие микро-сервисы. Опыт работы с одним из фреймворков (django, flask, aiohttp). Опыт работы с PostgreSQL, MongoDB. Будет плюсом опыт работы с NSQ. "
Junior Python Developer,,https://hh.ru/vacancy/35631853?query=python,ООО Верме,,"Основной сервис планирования: клиент - самописный MVC-подобный движок, отдельные компоненты на vue.js, графика на canvas, сервер - Django, Python, PostgreSQL.  Опыт работы от одного года. Уверенное значение Python, Django, PostgreSQL. Понимание принципов распределенной работы над созданием программного кода. "
Data Engineer (Python),90 000-120 000 руб.,https://hh.ru/vacancy/35816801?query=python,ООО КИБЕРТОНИКА,," Уверенные знания Python. Понимание принципов работы баз данных и систем хранения данных. Опыт применения библиотек Pandas, Dask, Airflow. "
Python/Go Developer,,https://hh.ru/vacancy/34567979?query=python, ДомКлик,,"Понимающее IT-руководство. Например, у нас есть квота 1 день в неделю на борьбу с тех. долгом/саморазвитие/рисеч/решение... Бизнес-руководство, нацеленное на результат. Пробовали: Tornado/Django/Pyramid. Работали с Docker, раскатывали ansible, слышали про kubernetes. Имеют опыт работы..."
Senior Python Developer,150 000-150 000 руб.,https://hh.ru/vacancy/35729180?query=python, МедиаНация,,"Основные модули системы: Парсинг, API интеграции и импорт в граф. Онтологии. Миграции. Склейка. Визуализация на карточках и диаграммах. Редактирование данных.  Отличное знание и навыкки разработки на Python 3.6+ (ООП) - опыт от 3-х лет. Высокая скорость разработки. "
Разработчик Python,,https://hh.ru/vacancy/36033163?query=python, ИТЕРАНЕТ,,"Разработка серверных компонентов систем. Уверенное знание Python 3.x и стандартных библиотек. Опыт работы с web framework Tornado, CherryPy. Опыт работы с корутинами (Python..."
Python разработчик (middle+/senior),от 150 000 руб.,https://hh.ru/vacancy/35807292?query=python,ООО СИБРУС,,"Разработка нового функционала на Django (создание кода с нуля), личного кабинета и собственного API. Проектирование архитектуры решения. Разработка FrontEnd’а... Уверенное владение Python 3.6+ (ООП). Опыт разработки веб-приложений на Django. NoSQL(Redis). SQL (PostgreSQL). Asyncio, aiohttp. "
Разработчик Python,от 100 000 руб.,https://hh.ru/vacancy/35908588?query=python,АО НейроТренд,,"Поддержка и разработка web-части проекта с использованием Python / Django / Django Rest Framework. Документирование/тестирование написанного кода. Развитие существующего кода. Знание Python 3.5, Django Rest Framework. Знание MySQL/PostgreSQL - второе крайне желательно. Опыт использования noSQL. Опыт работы с git..."
Python backend developer,100 000-160 000 руб.,https://hh.ru/vacancy/35610836?query=python,ООО Агро Роботик Системс,,"Проектирование и разработка back-end сервиса. Разработка алгоритмов и их реализация. Написание автоматических тестов (gtest, pytest). Документирование кода (doxygen).  Опыт командной разработки ПО от 2-х лет. Python3 и/или С++11. Уверенное работа с Linux (Ubuntu, ssh..."
Python Developer,,https://hh.ru/vacancy/35645809?query=python,ООО Лаборатория визуализации-Сфера,,Разработка backend-сервисов на Python 3+. Рефакторинг и соблюдение стандартов качества кода. Написание интеграционных и юнит-тестов.  Теоретические знания и опыт применения Python 3 +. Желание развиваться. Опыт работы с реляционными СУБД.
Python-разработчик,,https://hh.ru/vacancy/35447702?query=python, Kokoc Group,, Опыт разработки на Python/Django от 2-х лет. Опыт работы с PostgreSQL/Redis. Опыт разработки Single Page Applications. 
Team lead(Python/JS/DevOps),от 200 000 руб.,https://hh.ru/vacancy/35826095?query=python, Ремонтиста,," Опыт разработки мобильных приложений. Опыт backend разработки, интересует стек Python/Go/MongoDB/Postgres, знание React. Желателен опыт с Cordova/Ionic..."
Разработчик Python,,https://hh.ru/vacancy/35990977?query=python, ADV/web-engineering,,"Писать качественный, понятный коллегам код и придерживаться высоких стандартов разработки. Участвовать в code review - чтобы держать планку и не пропускать... Уверенные знания Python и наличие реализованных проектов. Опыт асинхронного программирования (aiohttp - желательно). Опыт работы с Elasticsearch/ PostgreSQL/ RabbitMQ. "
Python разработчик,,https://hh.ru/vacancy/34322458?query=python, Новые Облачные Технологии,,"Разработка middleware для работы с S3 хранилищами. Разработка сопутствующих подсистем (Поиска/Аутентификации и т.д.). Интеграция решений с существующей... Уверенное владение Python, опыт разработки сетевых приложений. Понимание сетевого стека TCP/IP и основных протоколов. Знание Linux на уровне опытного..."
Технический переводчик/Программист Python,,https://hh.ru/vacancy/35642592?query=python, Gaijin Entertainment,," Опыт работы: перевод и составление технической документации на английском языке от 1,5 лет. - Знание Python. - Знание Restrctured Text, sphinx. - "
Python - разработчик,,https://hh.ru/vacancy/35725687?query=python, МедиаНация,,Организация системы сбора данных по API из различных источников и передачи их в различные базы данных с целью последующего объединения... Высшее техническое образование будет являться вашим преимуществом. Знание и навыки разработки на Python 3 от 2-х лет. 
Python Разработчик,,https://hh.ru/vacancy/35882786?query=python, Colvir Software Solutions,,"Разрабатывать сервисы интеграции, доставки и обновления продуктов компании Colvir. Frontend и backend часть. - Docker-контейнеры и Kubernetes. Gitlab CI. Что мы хотим видеть в кандидатах: - Опыт работы Python разработчиком от двух лет. - Навыки разработки микросервисов. - "
Python Developer/Analyst,1 200-3 000 USD,https://hh.ru/vacancy/33522088?query=python, LATOKEN,,"Conduct market and product research. Automate all user data collection and integration. Provide analytical support to product managers. Database maintenance.  Experience in Python and/or JavaScript. Basic knowledge of Linux/bash. Knowledge of pandas, requests, beautifulsoap, scrapy, etc. "
Программист Python,,https://hh.ru/vacancy/35726384?query=python,ООО НТБ,,"Компания является разработчиком нового для рынка продукта в области управления привилегированным доступом. Вас ожидает интересная работа в области построения алгоритмов... Предыдущий опыт и интерес создания ПО на Python, с использованием различных фреймворков. Опыт создания распределённых/микросервисных систем, понимание принципов работы..."
Программист C++/Python,от 90 000 руб.,https://hh.ru/vacancy/35909189?query=python,АО Интегрис,,"Разработка алгоритмов для интеллектуальных транспортных систем. Анализ точности и потенциала прототипов. Реализация и оптимизация алгоритмов (компьютерное зрение, машинное обучение).  Опыт работы программистом С++ или программистом-исследователем Python. Умение и желание разбираться в чужом коде. Знание базовых библиотек python как..."
Python developer,170 000-230 000 руб.,https://hh.ru/vacancy/35572180?query=python, AppQuantum,,"Разработкой собственных мобильных игр и приложений. Паблишингом мобильных игр и приложений. Рекламой и маркетингом мобильных игр и приложений.  Опыт работы Python разработчиком от 2-х лет. Наличие законченных проектов API для мобильных приложений. Желание делать красивые, интересные и..."
Senior Engineer (Python),,https://hh.ru/vacancy/36024664?query=python, Авито,,Проектировать архитектуру решений для борьбы с ботами с учётом требований по быстродействию и надёжности. Разрабатывать технически сложные решения или их... Имеете навыки разработки высоконагруженных систем на Python. Владеете SQL и способны анализировать большие объемы данных из разных источников. 
Программист Python (киберспорт),,https://hh.ru/vacancy/32493929?query=python,АО Технологическая Компания Центр,,"Разрабатывать сервисы получения потока данных от поставщиков и из публичных источников. Разрабатывать и поддерживать сервисы обработки и хранения данных.  Опыт коммерческой разработки Python от 2 лет. Знание MongoDB, Docker. Быстрая обучаемость - для решения наших задач часто приходится сталкиваться с..."
Программист Python,,https://hh.ru/vacancy/35870480?query=python,АО РТИ,,"Разработка бизнес-логики для WEB приложений. Cоздание WEB сервисов. Pешение интеграционных задач. Участие в разработке архитектуры и дизайна системы. Python (опыт разработки и отладки сервисов). GIT. Apache. Linux Debian. Будет плюсом: Опыт работы с библиотеками: GDAL, SciPy, NumPy, Flask."
Программист Back-End (Python),,https://hh.ru/vacancy/35692423?query=python, Ostec,,"Группа компаний Остек – крупнейшее в России и странах СНГ инжиниринговое предприятие, предоставляющее комплексные инженерно-консультационные услуги - от проведения аудитов предприятий... Высшее образование (профильное). Опыт работы на аналогичной позиции. Знание языка программирования Python. Владение английским языком на уровне чтения документации. "
Программист Python,,https://hh.ru/vacancy/34608956?query=python,ООО Сервионика,,"Участие в разработке платформы виртуализации на базе OpenStack. Разработка компонентов OpenStack. Взаимодействие с международным сообществом. Опыт разработки на Python от 3-х лет. Хорошее понимание объектно-ориентированной модели, опыт работы с unit-тестами. "
Web-разработчик (Python/ReactJS),от 100 000 руб.,https://hh.ru/vacancy/35988194?query=python, Федеральная антимонопольная служба,,"Разработка front-end интерфейса, как для внутренних пользователей ведомства, так и для внешних пользователей на официальном сайте. Работа с внутренними... Высшее образование. Опыт работы в качестве Web-разработчика от 1 года. Уверенные знания HTML 5, CSS 3, Java Script. "
Python разработчик,40 000-100 000 руб.,https://hh.ru/vacancy/36045894?query=python, Группа компаний «Триумф»,,"60% разработка бекенда на Python. 40% разработка веб компонентов и модулей на Javascript и WebGL. Умение логически рассуждать. Реализм, честность, прямота. Высокий уровень самоорганизации, зрелость личности. Аккуратность, перфекционизм. Амбиции. Python. Математика, линейная алгебра. Git."
Аналитик-разработчик (Python),,https://hh.ru/vacancy/35323205?query=python,АО Технологическая Компания Центр,,"Разработка математических моделей, описывающих виды спорта. Обработка статистических данных спортивных событий с целью построения будущих моделей прогнозирования. Мониторинг эффективности, стабильности... Твёрдые знания в прикладной математике: теория вероятностей, математическая статистика, теория игр, мат. моделирование. Владение Python: numpy, pandas, scipy, statsmodels, math. "
"Full-Stack developer Python, React",от 100 000 руб.,https://hh.ru/vacancy/35988263?query=python,ООО Ван,,"Работать над финтех и крипто проектами. В нашу команду ищем ответственного full stack разработчика, нацеленного на качественную работу с желанием учиться и развиваться (удаленно/remote). "
Senior Python Developer,,https://hh.ru/vacancy/35469057?query=python, ДомКлик,,"Проектировать архитектуру и разрабатывать решения по отказоустойчивости и производительности. Разрабатывать back-end для мобильных и web-приложений на Python.  Бизнес-руководство, нацеленное на результат. Анализировать и совершенствовать написанный код. Успели глубоко проникнуть в суть принципов ООП и шаблоны проектирования. "
